"interpret","crime_type","harm_level","harm_type","harm_score","action_type","uncertainty_score"
"An agreement to unlawfully take or steal immovable property (real estate) from its rightful owner.","property","individual","financial or economic",0.7,"conspiracy",0.2
"An agreement to unlawfully take (steal) immovable property (real estate).","property","individual","financial or economic",0.7,"conspiracy",0.12
"Failure to properly register dogs as required by the applicable animal control statute.","public order","community","community safety",0.2,"occured",0.2
"Noncompliance with the legal requirements set out in statute sections 503-A or 503-4 (a regulatory/administrative violation).","public order","institutional","community safety",0.2,"occured",0.8
"Failure to obtain a required dog license or pay associated fees, a regulatory offense subject to fines or other penalties.","public order","community","community safety",0.15,"occured",0.15
"Not an offense — a requirement that animals (likely pets) be vaccinated against rabies at 4–12 weeks of age.","not known/missing","societal","community safety",0,"occured",0.05
"Allegation concerning vehicle emissions inspection evidence (e.g., missing, falsified, or non‑compliant emissions inspection documentation).","criminal traffic","community","community safety",0.35,"occured",0.7
"An offense involving surrender of vehicle registration plates or registration cards when the vehicle's registration is suspended (a traffic/administrative violation).","criminal traffic","institutional","community safety",0.1,"occured",0.4
"Non‑consensual sharing or distribution of intimate/private images of a person without their consent.","public order","individual","privacy",0.7,"occured",0.2
"Alleged conspiracy to use or possess drug paraphernalia.","drug","individual","physical",0.2,"conspiracy",0.3
"A driver made an unsafe lane change or passed another vehicle on the right in violation of traffic laws, creating a roadway hazard.","criminal traffic","individual","community safety",0.4,"occured",0.1
"Possession of a firearm whose manufacturer/serial number has been altered, removed, or otherwise tampered with.","public order","community","community safety",0.6,"occured",0.1
"Aggravated assault in which the offender attempts to, or actually causes, bodily injury to specified/ designated individuals.","violent","individual","physical",0.9,"occured",0.1
"Vandalism at an educational institution (damage to school/educational facility property).","property","institutional","financial or economic",0.35,"occured",0.5
"Providing a password, PIN, or other credential to enable unlawful access to a computer or account.","property","individual","privacy",0.6,"occured",0.25
"Improper display of a vehicle license plate (e.g., obscured, covered, not properly affixed or visible).","criminal traffic","community","community safety",0.12,"occured",0.05
"Driver failed to keep their vehicle to the right side of the roadway as required by traffic laws.","criminal traffic","community","community safety",0.2,"occured",0.1
"Driving 18 miles per hour over a posted 55 mph speed limit (i.e., about 73 mph) in a non-specified/other location.","criminal traffic","community","community safety",0.4,"occured",0.1
"Wrongfully interfering with the lawful custody or care of a child (e.g., taking or withholding a child from a custodial parent or guardian).","public order","individual","emotional or psychological",0.7,"occured",0.15
"Conspiring to commit aggravated assault by attempting or causing bodily injury with a deadly weapon.","violent","individual","physical",0.9,"conspiracy",0.05
"A sexual offense involving forcible compulsion to engage in indecent or sexual acts (indecent solicitation)","violent","individual","physical",0.9,"occured",0.3
"An individual attempted to sexually assault (rape) another person by using threats of forcible compulsion.","violent","individual","physical",0.9,"attempted",0.1
"Non-consensual sexual contact or penetration inflicted on a person.","violent","individual","physical",0.95,"occured",0.2
"Aggravated indecent (sexual) assault committed without the victim's consent — a serious nonconsensual sexual/physical attack.","violent","individual","physical",0.9,"occured",0.1
"Failure to sign a required registration card (administrative paperwork not completed).","public order","institutional","financial or economic",0.05,"occured",0.4
"A threat to rape someone using forcible compulsion, indicating intent to commit sexual violence or coerce the victim.","violent","individual","physical",0.9,"attempted",0.2
"Conspiracy to issue or provide an access device (e.g., credit/debit card, account credentials) to another person who was not authorized to use it.","property","individual","financial or economic",0.7,"conspiracy",0.25
"Alleged conspiracy to commit defiant trespass (unauthorized entry), with a note about an 'actual communication' to another party.","property","individual","privacy",0.25,"conspiracy",0.75
"A person was cited for not carrying a required license (likely a driver’s license) while operating or in control of a vehicle.","criminal traffic","community","community safety",0.1,"occured",0.2
"Deceptive/business-practice offense involving the sale or distribution of adulterated (contaminated or impure) goods.","public order","community","physical",0.7,"occured",0.2
"Possession, sale, use, or display of (likely forged or unauthorized) documents such as identification, permits, or credentials.","public order","institutional","community safety",0.5,"occured",0.5
"Improper, unauthorized, or falsified use of an inspection certificate (e.g., for equipment, vehicles, or premises), violating regulatory inspection requirements and risking public safety.","public order","community","community safety",0.45,"occured",0.6
"Agreement to commit a burglary of an overnight accommodation where no person was present (conspiracy to burglarize property).","property","individual","financial or economic",0.6,"conspiracy",0.1
"A vehicle made a left-hand turn (likely referring to a traffic maneuver or a possible traffic violation involving turning left).","criminal traffic","community","community safety",0.15,"occured",0.8
"Prohibits any person from possessing or selling drug paraphernalia.","drug","individual","physical",0.45,"occured",0.1
"Forcible taking (carjacking) of a motor vehicle from a person, typically involving threats or use of force.","violent","individual","physical",0.8,"occured",0.1
"Sexual assault (rape) committed against a minor/child.","violent","individual","physical",1,"occured",0.02
"A forcible rape in which the offender compelled the victim to engage in sexual intercourse by force or threat.","violent","individual","physical",0.95,"occured",0.05
"Aggravated indecent assault of a complainant under 16 years old (sexual assault of a minor).","violent","individual","physical",0.9,"occured",0.2
"Indecent (sexual) assault of a person under 16 years of age (sexual assault of a minor).","violent","individual","physical",0.9,"occured",0.15
"Deceptive business practice involving false or misrepresented credentials or statements about qualifications or status.","property","individual","financial or economic",0.65,"occured",0.25
"Willfully failing to remit taxes owed to the Commonwealth (state), i.e., not paying required tax obligations.","property","institutional","financial or economic",0.6,"occured",0.1
"An agreement to commit burglary of a non-residential property (not suitable for overnight accommodation) where no person was present.","property","individual","financial or economic",0.5,"conspiracy",0.1
"Ambiguous short description — likely refers to the act of using headphones where that behavior is prohibited (e.g., while driving, at work, or in a school), but context is missing.","not known/missing","individual","community safety",0.05,"occured",0.9
"Driving 25 mph over the posted 55 mph speed limit in a non-specified/other location.","criminal traffic","community","community safety",0.6,"occured",0.1
"Sharing or transferring someone’s private image via telephone, email, internet, or similar means without consent, constituting an invasion of privacy.","public order","individual","privacy",0.6,"occured",0.25
"An agreement to receive, possess, or distribute property known to be stolen.","property","individual","financial or economic",0.6,"conspiracy",0.1
"Driving 15 mph over a posted 55 mph speed limit (e.g., 70 mph in a 55 zone) in the specified location.","criminal traffic","community","community safety",0.35,"occured",0.1
"Sexual exploitation involving the creation, possession, or distribution of sexually explicit images or videos of minors.","violent","individual","emotional or psychological",0.95,"occured",0.05
"Failure to obey a traffic control device (e.g., signals, signs) resulting in or creating a hazardous condition for road users.","criminal traffic","community","community safety",0.6,"occured",0.25
"Refusal to leave or disperse from a location after being ordered to do so by an official (e.g., police) during a crowd/assembly situation.","public order","community","community safety",0.2,"occured",0.2
"Alleged fraud involving altering, forging, or counterfeiting titles, registration, or insurance documents (e.g., vehicle titles/regs/insurance).","property","individual","financial or economic",0.75,"occured",0.25
"A regulatory prohibition on spending funds for emission inspections — i.e., forbidding expenditures to perform or support emission testing/inspections, which could impede environmental monitoring.","public order","community","community safety",0.5,"occured",0.6
"Fraudulent acquisition of property through deception, involving a failure to correct false information or to remedy the deception.","property","individual","financial or economic",0.75,"occured",0.15
"Second-offense of driving with a license suspended/revoked under the DUI-related statute (Section 3802/1547(b)(1)).","criminal traffic","community","community safety",0.65,"occured",0.2
"Driver exceeded the posted maximum speed limit by 15 miles per hour.","criminal traffic","community","community safety",0.25,"occured",0.05
"Repeated anonymous communications sent to harass or distress a person.","public order","individual","emotional or psychological",0.5,"occured",0.15
"Someone attempted to flee to avoid being stopped or arrested by a police officer, creating risk to public safety.","criminal traffic","community","community safety",0.65,"attempted",0.15
"Driving a vehicle without lights with the intent to avoid being identified or arrested.","criminal traffic","community","community safety",0.5,"occured",0.3
"A person supplied or distributed illegal drugs and the drug use led to another person's death.","drug","individual","physical",0.9,"occured",0.1
"Agreement to commit fraud involving an access device (e.g., credit/debit card) that is unauthorized by the issuer.","property","individual","financial or economic",0.6,"conspiracy",0.15
"An individual was held against their will and forced into confinement or labor (unlawful restraint/involuntary servitude).","violent","individual","physical",0.95,"occured",0.05
"Harboring or concealing a person to hinder their appearance in court or prosecution (obstruction of justice).","public order","institutional","community safety",0.5,"occured",0.1
"An agreement to commit acts that inflict physical harm or cruelty on animals.","violent","individual","physical",0.75,"conspiracy",0.2
"Driver exceeded the posted maximum speed limit by 10 miles per hour.","criminal traffic","community","community safety",0.15,"occured",0.1
"Unauthorized entry onto someone else’s property or premises without permission.","property","individual","privacy",0.3,"occured",0.1
"Unauthorized access to a computer system to transfer money from a victim's account to another account.","property","individual","financial or economic",0.8,"occured",0.2
"Providing false information to a law enforcement officer to hinder apprehension or prosecution.","public order","institutional","community safety",0.5,"occured",0.2
"An agreement between two or more people to knowingly receive, possess, or traffic in stolen property.","property","individual","financial or economic",0.6,"conspiracy",0.2
"Making a false report or alarm to a public safety agency (e.g., a hoax 911 call) that misleads responders and diverts emergency resources.","public order","community","community safety",0.4,"occured",0.15
"Defendant committed trespass on posted (no-trespassing) property.","property","individual","community safety",0.2,"occured",0.35
"Failure to use a vehicle's turn signal when turning or changing lanes, creating a potential traffic safety hazard.","criminal traffic","community","community safety",0.08,"occured",0.05
"Urinating or defecating in a public place, a minor public-order offense that affects public sanitation and community comfort.","public order","community","community safety",0.2,"occured",0.05
"A party failed to provide the required legal title or ownership documentation to the buyer/transferee after a transfer, preventing proper transfer of ownership.","property","individual","financial or economic",0.5,"occured",0.3
"Vehicle was parked illegally within an intersection, obstructing traffic and creating a safety hazard.","criminal traffic","community","community safety",0.15,"occured",0.1
"An offender physically blocked a person's nose and mouth, causing strangulation/asphyxiation.","violent","individual","physical",0.95,"occured",0.05
"Administrative suspension or revocation of a driver's license related to a drug offense pursuant to sections 3731/1547(b)(1).","drug","individual","community safety",0.35,"occured",0.75
"A dog attacked a person resulting in serious injury or fatality.","violent","individual","physical",0.9,"occured",0.05
"A regulation requiring vaccination and proof of vaccination (certificate and tag), likely for animals or public health compliance.","public order","community","community safety",0.15,"occured",0.6
"Unlawfully restraining or imprisoning a person by keeping them confined inside the property owned by another (false imprisonment/illegal confinement).","violent","individual","physical",0.7,"occured",0.35
"Keeping or harboring a dog that has been designated or determined to be dangerous, creating a public safety risk.","public order","community","community safety",0.5,"occured",0.3
"An individual attempted to commit forgery by presenting or offering a forged document (uttering a forged writing) to deceive and obtain benefit or cause loss.","property","individual","financial or economic",0.6,"attempted",0.25
"An aggravated assault in which designated individuals were placed in fear of imminent serious bodily injury.","violent","individual","physical",0.85,"occured",0.15
"Extreme speeding — driving 55 mph over the posted 55 mph speed limit in a non‑specified location (i.e., traveling around 110 mph in a 55 zone).","criminal traffic","community","community safety",0.7,"occured",0.1
"An agreement between two or more people to knowingly pass bad checks to defraud recipients.","property","individual","financial or economic",0.7,"conspiracy",0.1
"Deliberately making or submitting false allegations of child abuse to authorities, harming the accused child/family and wasting child-protection resources.","public order","individual","emotional or psychological",0.7,"occured",0.15
"Repeated communications at inconvenient hours intended to harass or disturb a person.","public order","individual","emotional or psychological",0.5,"occured",0.1
"Knowingly hiding or refusing to disclose the location of a child to a lawful custodian or authorities, interfering with custody or access rights.","public order","individual","emotional or psychological",0.6,"occured",0.2
"An individual followed and harassed another person in a public place, causing fear or distress.","public order","individual","emotional or psychological",0.4,"occured",0.1
"Driving under the influence by a minor (first offense).","dui offense","individual","physical",0.6,"occured",0.2
"Driving 1 mph over the posted 55 mph speed limit in an unspecified/other location (a minor speeding offense).","criminal traffic","community","community safety",0.05,"occured",0.1
"Refusal to allow an authorized inspection (e.g., by police, customs, health or building inspectors) when such an inspection is required by law or regulation.","public order","institutional","community safety",0.25,"occured",0.6
"Submitting or preparing a false, fraudulent, or incomplete insurance claim to obtain benefits improperly.","property","individual","financial or economic",0.6,"occured",0.2
"Allegation of insurance fraud where the defendant intended to deceive an insurer to obtain financial benefit.","property","institutional","financial or economic",0.65,"attempted",0.2
"Sexual activity between an older individual and a person below the age of consent where the offender is 4–8 years older, constituting statutory sexual assault.","violent","individual","physical",0.9,"occured",0.15
"Failure to comply with a required address verification or photographic registration (e.g., not confirming residence or refusing to be photographed for a registry).","public order","community","community safety",0.3,"occured",0.6
"A vehicle was left unattended on private property, likely creating a parking or nuisance violation.","public order","community","community safety",0.15,"occured",0.1
"Presence of drugs creating a hazardous or physically offensive condition (e.g., meth lab, drug waste, or severe drug-related contamination) that threatens public health and safety.","drug","community","community safety",0.7,"occured",0.4
"Making a U-turn in a manner that creates a traffic hazard or violates traffic laws.","criminal traffic","individual","physical",0.3,"occured",0.1
"Someone falsely presents themselves as a government official or public servant to deceive others and possibly gain authority, access, or benefits.","public order","institutional","community safety",0.6,"occured",0.2
"Driver exceeded the posted maximum speed limit by 21 miles per hour.","criminal traffic","community","community safety",0.35,"occured",0.05
"Operating a vehicle 22 miles per hour over the posted speed limit.","criminal traffic","community","community safety",0.35,"occured",0.05
"Intentional damage to or destruction of another person's property (vandalism).","property","individual","financial or economic",0.3,"occured",0.1
"Providing or attempting to provide clean or fake urine to help someone evade a drug test.","drug","institutional","community safety",0.3,"attempted",0.2
"Attempted/unlawful sale of a product (clean/fake urine) intended to circumvent drug testing.","drug","community","community safety",0.45,"attempted",0.2
"An individual attempted to manufacture, deliver, or possess controlled substances with intent to manufacture or deliver them.","drug","societal","community safety",0.7,"attempted",0.1
"Second offense for operating a vehicle with a blood alcohol concentration of 0.02% or greater (a DUI/zero-tolerance driving alcohol violation).","dui offense","community","physical",0.7,"occured",0.25
"Misuse or improper communications to emergency 911 services (e.g., non‑emergency, harassing, prank, or false calls that burden emergency response).","public order","community","community safety",0.45,"occured",0.3
"Driving 20 miles per hour over the posted maximum speed limit.","criminal traffic","community","community safety",0.45,"occured",0.1
"Using a motor vehicle to violently assault another person, causing or risking serious physical injury or death.","violent","individual","physical",0.9,"occured",0.1
"Negligent or careless operation of a vehicle that resulted in serious bodily injury to another person.","violent","individual","physical",0.8,"occured",0.08
"Providing or selling alcoholic beverages to a person under the legal drinking age.","public order","individual","physical",0.35,"occured",0.1
"A person sexually assaulted another by using force or threats to compel unwanted sexual contact.","violent","individual","physical",0.9,"occured",0.05
"Aggravated indecent assault involving forcible compulsion—i.e., a sexual assault using force or threats against a victim.","violent","individual","physical",0.9,"occured",0.1
"Third-offense driving under the influence with a high blood alcohol concentration (.16 or higher).","dui offense","individual","physical",0.75,"occured",0.05
"A vehicle's license plates were obscured so they could not be read at a reasonable distance, likely to evade identification or enforcement.","criminal traffic","community","community safety",0.25,"occured",0.1
"Agreement among parties to possess a small amount of marijuana for personal use.","drug","individual","physical",0.15,"conspiracy",0.08
"A formal notice indicating a regulatory or code violation that requires corrective action (e.g., building, health, or permit noncompliance).","not known/missing","institutional","community safety",0.15,"occured",0.8
"A driver made an improper turn at an intersection despite a green traffic signal.","criminal traffic","community","community safety",0.2,"occured",0.2
"An attempted offense to introduce or supply a telecommunication device as contraband (likely into a correctional facility).","public order","institutional","community safety",0.45,"attempted",0.2
"Failure to provide necessary food and/or water to animals, causing neglect and likely physical harm to the animals.","property","individual","physical",0.8,"occured",0.15
"Refers to the legal designation or group of individuals who repeatedly commit crimes (repeat offenders) rather than a specific single offense.","not known/missing","societal","community safety",0.2,"occured",0.85
"Fourth-offense driving under the influence (DUI) with an elevated BAC of .16 or higher, a repeat/subsequent offense.","dui offense","individual","physical",0.85,"occured",0.2
"Driving under the influence of a controlled substance or its metabolite, second offense (repeat DUI).","dui offense","individual","physical",0.75,"occured",0.05
"Selling alcoholic beverages in violation of laws or regulations (for example without a license, to minors, or outside permitted times).","public order","community","community safety",0.3,"occured",0.5
"Operating a vehicle over a roadway divider/median, a traffic violation that can endanger other road users and property.","criminal traffic","community","community safety",0.35,"occured",0.25
"Driver failed to yield the right of way to another road user, violating traffic law and creating a risk of collision.","criminal traffic","individual","physical",0.35,"occured",0.1
"Failure to properly use required child safety restraints for a child under two years old (e.g., not securing an infant in an appropriate car seat).","criminal traffic","individual","physical",0.6,"occured",0.25
"A regulatory requirement that certain vehicles involved in accidents must undergo testing as part of accident investigations.","not known/missing","community","community safety",0.1,"occured",0.8
"Likely a traffic-related offense concerning vehicle signal lights (e.g., failure to use turn signals or improper use/maintenance of lights).","criminal traffic","community","community safety",0.15,"occured",0.7
"Deliberately setting a fire in a manner that creates a risk of death or bodily injury to people.","violent","community","community safety",0.9,"occured",0.15
"A vehicle was parked illegally within a designated safety zone (e.g., bus stop or pedestrian safety area), creating a hazard or obstruction.","criminal traffic","community","community safety",0.15,"occured",0.2
"Improper parking on a two-way highway (parking violation that may obstruct traffic or create a hazard).","criminal traffic","community","community safety",0.15,"occured",0.4
"Failure to maintain or follow a designated traffic lane (e.g., improper lane change or driving outside marked lanes).","criminal traffic","community","community safety",0.4,"occured",0.1
"Attempted promotion/facilitation of prostitution by an inmate at a house of prostitution or related business.","public order","community","community safety",0.35,"attempted",0.4
"Vehicle is cited for having an improper or noncompliant muffler (a vehicle equipment/traffic violation).","criminal traffic","community","community safety",0.1,"occured",0.15
"An agreement (conspiracy) to possess a firearm by someone who is legally prohibited from having one.","violent","community","physical",0.7,"conspiracy",0.1
"Agreement between two or more people to carry firearms without the legally required license.","violent","community","physical",0.7,"conspiracy",0.2
"An agreement to commit criminal mischief involving damaging another person's property.","property","individual","financial or economic",0.6,"conspiracy",0.1
"Driving while impaired by a controlled substance (third DUI offense), indicating reduced ability to safely operate a vehicle.","dui offense","community","community safety",0.85,"occured",0.1
"Driver failed to comply with lane-use rules by disregarding a prohibited traffic lane.","criminal traffic","community","community safety",0.3,"occured",0.1
"An agreement (criminal conspiracy) to commit burglary of an overnight accommodation/residence where no person was present.","property","individual","financial or economic",0.6,"conspiracy",0.1
"A driver’s careless driving resulted in an unintended fatality.","criminal traffic","individual","physical",0.9,"occured",0.1
"An attempted aggravated assault where the defendant tried to cause serious bodily injury or acted with extreme indifference causing injury.","violent","individual","physical",0.9,"attempted",0.05
